{
  "$schema": "https://json-schema.org/draft/2020-12/schema",
  "$id": "https://example.invalid/schemas/climate-tile-0.1.json",
  "title": "Madagascar climate tile",
  "type": "object",
  "required": ["schemaVersion", "tileId", "status", "locations"],
  "properties": {
    "schemaVersion": { "const": "0.1" },
    "tileId": { "type": "string", "pattern": "^[NS][0-9]{2}_[EW][0-9]{3}$" },
    "status": { "enum": ["fixture", "candidate", "operational"] },
    "locations": {
      "type": "array",
      "items": {
        "type": "object",
        "required": ["id", "name", "coordinates", "rainfall", "temperature"],
        "properties": {
          "id": { "type": "string" },
          "name": { "type": "string" },
          "coordinates": {
            "type": "object",
            "required": ["lat", "lon"],
            "properties": {
              "lat": { "type": "number", "minimum": -26, "maximum": -11 },
              "lon": { "type": "number", "minimum": 43, "maximum": 51 }
            }
          },
          "rainfall": {
            "type": "object",
            "required": ["monthlyTotalMm", "rainyDays", "wetDayIntensityMm", "drySpellRisk10d"],
            "properties": {
              "monthlyTotalMm": { "$ref": "#/$defs/monthArray" },
              "rainyDays": { "$ref": "#/$defs/monthArray" },
              "wetDayIntensityMm": { "$ref": "#/$defs/monthArray" },
              "drySpellRisk10d": { "$ref": "#/$defs/probabilityArray" }
            }
          },
          "temperature": {
            "type": "object",
            "required": ["monthlyMinC", "monthlyMaxC"],
            "properties": {
              "monthlyMinC": { "$ref": "#/$defs/monthArray" },
              "monthlyMaxC": { "$ref": "#/$defs/monthArray" }
            }
          }
        }
      }
    }
  },
  "$defs": {
    "monthArray": {
      "type": "array",
      "minItems": 12,
      "maxItems": 12,
      "items": { "type": "number" }
    },
    "probabilityArray": {
      "type": "array",
      "minItems": 12,
      "maxItems": 12,
      "items": { "type": "number", "minimum": 0, "maximum": 1 }
    }
  }
}

