{
  "schemaVersion": "0.1",
  "tileId": "S19_E047",
  "status": "fixture",
  "locations": [
    {
      "id": "antananarivo",
      "name": "Antananarivo",
      "district": "Antananarivo Renivohitra",
      "region": "Analamanga",
      "coordinates": { "lat": -18.879, "lon": 47.507 },
      "cells": {
        "rain": { "lat": -18.875, "lon": 47.525, "resolutionDegrees": 0.05 },
        "temperature": { "lat": -18.85, "lon": 47.55, "resolutionDegrees": 0.1 }
      },
      "rainfall": {
        "monthlyTotalMm": [300, 255, 190, 55, 18, 9, 11, 12, 18, 75, 175, 285],
        "rainyDays": [18, 16, 14, 7, 3, 2, 2, 2, 3, 8, 14, 18],
        "wetDayIntensityMm": [12.5, 11.9, 10.3, 6.0, 3.7, 2.8, 3.1, 3.2, 3.8, 6.7, 9.2, 11.8],
        "drySpellRisk10d": [0.10, 0.12, 0.17, 0.48, 0.78, 0.90, 0.91, 0.89, 0.80, 0.48, 0.21, 0.11]
      },
      "temperature": {
        "monthlyMinC": [17.1, 17.0, 16.2, 14.1, 11.2, 9.1, 8.4, 8.7, 10.3, 13.0, 15.1, 16.7],
        "monthlyMaxC": [27.1, 27.0, 26.3, 25.1, 23.0, 21.1, 20.5, 22.1, 24.9, 27.0, 28.0, 27.4]
      },
      "current": {
        "through": "2026-08-31",
        "releaseType": "demonstration",
        "yearToDateRainMm": 820,
        "normalToDateRainMm": 850,
        "anomalyPercent": -3.5
      }
    }
  ]
}

